timestamp,sentence,author
2023-09-29 17:25:00,"Alibaba Group Holding Ltd. ADR rises Friday, outperforms market",by MarketWatch Automation
2023-09-29 10:55:00,"Blue Apron notches triple-digit percentage gain while Nike rallies after earnings beat, boosting rivals as well as retailer Foot Locker",by MarketWatch
2023-09-29 08:49:00,Fortnite parent company Epic Games in the spotlight as tech layoffs roll on,by James Rogers
2023-09-29 07:46:00,"Nio’s, Alibaba’s stocks get a boost from China’s cyberspace regulator",by Tomi Kilgore
2023-09-29 05:51:00,"Alibaba, NIO, XPeng Stocks Climb. Chinese Businesses Get a Regulatory Boost.",by Barron's
2023-09-28 17:25:00,"Alibaba Group Holding Ltd. ADR falls Thursday, underperforms market",by MarketWatch Automation
2023-09-27 17:26:00,"Alibaba Group Holding Ltd. ADR rises Wednesday, outperforms market",by MarketWatch Automation
2023-09-27 03:00:00,"For This Pro, China’s Slowdown Won’t Hold Back These Luxury Stocks",by Barron's
2023-09-26 22:04:00,Alibaba’s logistics unit files for Hong Kong IPO,by MarketWatch Automation
2023-09-26 17:25:00,Alibaba Group Holding Ltd. ADR outperforms market despite losses on the day,by Emily Bary
2023-09-26 10:07:00,Alibaba continues plans for value unlock as it seeks spinoff of logistics unit,by MarketWatch Automation
2023-09-25 17:25:00,"Alibaba Group Holding Ltd. ADR falls Monday, underperforms market",by Barron's
2023-09-25 08:56:00,"Evergrande Debt Fears Mount, Weighing on Chinese Stocks",by Barron's
2023-09-22 16:37:00,"These Stocks Moved the Most Today: Ford, Activision, Alibaba, Squarespace, Amazon, Scholastic, and More",by Emily Bary
2023-09-22 10:20:00,Alibaba and other Chinese shares bounce back as China reportedly looks to re-energize its stock market,by Barron's
2023-09-22 06:36:00,"Alibaba, JD.com Stocks Rise on Report of China Easing Ownership Limits",by Barron's
2023-09-21 13:42:00,"China Is in Trouble, but It’s No Disaster. Don’t Run Scared.",by Barron's
2023-09-19 07:02:00,U.S. Business Confidence Hits Record Low in China. Days of Outperformance May Be Over.,by Barron's
2023-09-18 14:34:00,SoftBank Could Boost Its Stock With a Big Buyback: Analyst,by Barron's
2023-09-18 05:20:00,Alibaba Plans to Invest $2 Billion in Turkey,by Barron's
2023-09-15 07:20:00,"Alibaba, JD.com Show the Jury Is Still Out on China’s Economy Amid Strong Data",by Barron's
2023-09-14 16:10:00,Arm Stock Closes 25% Above IPO Price in Public Debut,by Barron's
2023-09-13 13:07:00,"Alibaba to Make Its AI Model Public, But Its Cloud Spinoff Still Seems Far Off",by Barron's
2023-09-13 09:26:00,Some Chinese Stocks Are a Real Bargain Now. Alibaba Is One of Them.,by Isabel Wang
2023-09-13 01:26:00,Alibaba Introduces Its AI Model to Public,by Barron's
2023-09-12 09:00:00,Alibaba’s New CEO Shares His 2 Big Priorities,by MarketWatch
2023-09-12 00:31:00,Alibaba Group CEO Sets Core Priorities,by Barron's
2023-09-11 16:27:00,"Dow scores third day of gains ahead of coming inflation, retail-sales data",by Barron's
2023-09-11 16:20:00,"These Stocks Moved the Most Today: Tesla, Qualcomm, Disney, Hostess Brands, RTX, Meta, and More",by Tomi Kilgore
2023-09-11 12:09:00,"Tesla and Canopy Growth stocks surge, RTX and J.M. Smucker shares fall, and other stocks on the move",by Barron's
2023-09-11 08:52:00,Alibaba Stock Falls After Former CEO Steps Down From Cloud Business,by Barron's
2023-09-10 22:59:00,Alibaba’s ex-chairman Daniel Zhang steps down as CEO of cloud business unit,by Barron's
2023-09-08 07:27:00,Economists See China Still in Deflation. What Knife-Edge Estimates Mean for Alibaba.,by Barron's
2023-09-07 12:50:00,"Nio, Alibaba stocks drop as part of broad selloff in the ADS of China-based companies",by Barron's
2023-09-07 09:15:00,Alibaba Stock Falls. More Economic Data From China Weighs on Shares.,by Barron's
2023-09-05 11:27:00,"It Isn’t Just Alibaba Stock. Why the Latest Grim China Data Hit LVMH, Too.",by Barron's
2023-09-04 06:17:00,"Alibaba, JD.com Stocks Surge. Why China’s Property Stimulus Is Boosting Tech Giants.",by Barron's
2023-09-04 05:15:00,Global Stocks Climb on China Rebound. There Could Be More Stimulus to Come.,by Barron's
2023-08-31 09:19:00,Alibaba Stock Set to Drop for Second Day. Why It’s Time to Look Past China’s Misery.,by Barron's
2023-08-31 01:30:00,Luxury Stocks Are Going Out of Fashion. It’s the China Syndrome.,by Barron's
2023-08-29 17:04:00,Nvidia Stock Hits a Record High. Watch These 3 Things.,by Barron's
2023-08-29 09:17:00,Alibaba and Other China Stocks Rise Again. Why Long-Term Gains May Be Harder.,by Barron's
2023-08-28 16:14:00,"These Stocks Moved the Most Today: 3M, Jabil, Hawaiian Electric, Boston Scientific, XPeng, Nvidia, and More",by Barron's
2023-08-28 09:38:00,"Alibaba, JD.com, and Other Chinese Stocks Climb. What Is Behind the Rally.",by Barron's
2023-08-22 10:03:00,"Earnings Beat From Baidu, China’s Google, Cuts Through Economic Gloom",by Barron's
2023-08-18 05:01:00,Chinese Tech Stocks Tumble as Beijing Defends Yuan Amid Rising Economic Fears,by Barron's
2023-08-17 08:47:00,"Alibaba, JD.com Stocks Rebound. China Sets Out Plan to Hit Growth Targets.",by Emily Bary
2023-08-17 03:00:00,Chinese Tech Investors Jump Ship. Why That’s a Bad Sign.,by Christine Idzelis
2023-08-16 08:44:00,JD.com Posts Earnings Beat. But the Stock Can’t Shake the China Gloom.,by Joseph Adinolfi
2023-08-16 04:58:00,"China Stocks Hit as Selloff, House Prices, and Yuan Add to Economic Pain",by Tomi Kilgore
2023-08-15 11:35:00,Alibaba Stock Reveals Doubts That the Biggest China Rate Cuts Since Pandemic Can Save Economy,by Barron's
2023-08-15 08:06:00,"Dan Loeb’s Third Point wagers on Nvidia, Amazon, Uber with new positions",by Barron's
2023-08-14 17:38:00,China-focused ETFs drop as country’s property woes highlight ‘recession risks in China are real’,by Joseph Adinolfi
2023-08-11 16:17:00,"Dow posts gains Friday, Nasdaq records first back-to-back weekly loss of year",by Barron's
2023-08-11 11:33:00,"Nio and Alibaba shares sink, weighed down by Country Garden’s financial woes and downbeat China data",by Emily Bary
2023-08-11 07:41:00,"Country Garden, Like Evergrande Before It, Flags Huge Loss. The Stock Plummets.",by Emily Bary
2023-08-10 16:45:00,"These Stocks Moved the Most Today: Disney, Capri, Tapestry, Applovin, Yeti, and More",by Emily Bary
2023-08-10 16:24:00,"Dow, S&P 500 and Nasdaq eke out gains, but close below session highs after July’s inflation report",by Barron's
2023-08-10 07:57:00,Alibaba Stock Jumps as Earnings Smash Estimates. Why the Party Won’t Last.,by Emily Bary
2023-08-10 07:17:00,Alibaba’s stock advances after earnings beat,by Barron's
2023-08-10 06:51:00,Alibaba's Net Profit Surged in First Quarter on Higher Revenue,by Barron's
2023-08-10 06:15:00,Alibaba posts fiscal Q1 revenue of RMB234.156 billion vs. RMB224.7 billion FactSet consensus,by Barron's
2023-08-10 06:15:00,Alibaba shares up 2.7% premarket after earnings,by Barron's
2023-08-08 12:10:00,China Is Hit With Another Evergrande Moment as Woes Mount for Property Sector,by Barron's
2023-08-08 09:11:00,"Alibaba, Nio among China stocks falling amid downbeat economic data",by Barron's
2023-08-08 06:37:00,Alibaba Slumps After Grim Chinese Data. The S&P 500 Could Follow.,by Barron's
2023-08-06 14:00:00,"Disney, UPS, BioNTech, Palantir, and More Stocks to Watch This Week",by Barron's
2023-08-06 01:15:00,8 Funds to Consider if China’s Efforts to Revive Economy Gain Traction,by Emily Bary
2023-08-02 10:47:00,"Alibaba, Baidu, and NetEase Stocks Fall. What China’s New Smartphone Rules Mean for Tech.",by Barron's
2023-07-31 09:25:00,"Apple, Amazon, Starbucks, Uber, AMD, and More Stocks to Watch This Week",by Associated Press
2023-07-26 04:58:00,Alibaba Cloud to Support Meta AI Model for Chinese Users. Why It’s a Big Deal.,by James Rogers
2023-07-25 14:00:00,Worried About China Risk? Apple Stock Might Have Just as Much as Alibaba.,by Barron's
2023-07-25 13:11:00,Chinese Stocks Rally. But There Are Still Big Concerns—Especially in Real Estate.,by Barron's
2023-07-24 14:40:00,"Nio helps lead strong China stock rally amid upbeat economic commentary, while Alibaba shares get a lift",by James Rogers
2023-07-24 08:53:00,This Global Money Pro Wants to Talk About the Saudi-Iran Deal. It’s ‘Mind-Blowing.’,by Barron's
2023-07-24 02:58:00,Alibaba says it won’t sell stake in Ant Group,by Barron's
2023-07-21 06:48:00,"More than 221,000 global tech workers have lost their jobs this year",by Barron's
2023-07-18 06:16:00,Alibaba Stock Is Falling. Stimulus Hopes Only Go So Far Amid China Growth Fears.,by Barron's
2023-07-17 04:20:00,"China Growth Disappoints. Oil Falls, Stocks Are Mixed.",by Barron's
2023-07-14 09:43:00,"More than 218,000 global tech employees have lost their jobs since the start of 2023",by Ciara Linnane
2023-07-13 10:47:00,"Alibaba, JD.com Stocks Gain. China Is Backing Tech as Economy Splutters.",by Barron's
2023-07-13 01:29:00,Chinese internet stocks jump as Beijing signals support,by Ciara Linnane
2023-07-11 09:00:00,"Alibaba, JD.Com, and Other China Stocks Rebound on Hopes the Tech Crackdown Is Over",by James Rogers
2023-07-10 16:14:00,"These Stocks Are Moving the Most Today: Icahn Enterprises, Novavax, FMC, Cava, and More",by Steve Goldstein
2023-07-10 11:10:00,"Alibaba, JD.com Stocks Waver. China’s Tech Sector Caught Between Deflation Fears and End-of-Crackdown Hopes.",by MarketWatch
2023-07-07 16:37:00,"ADRs End Higher; Alibaba Group, Coca-Cola HBC Trade Actively",by Barron's
2023-07-07 16:21:00,"Rivian, Tesla, Alibaba, Levi Strauss, First Solar, and More Stock Market Movers",by James Rogers
2023-07-07 10:31:00,Alibaba’s shares rise after China fines Ant Group almost $1 billion for ‘illegal acts’,by Barron's
2023-07-07 10:29:00,Alibaba Stock Soars After China Fines Ant Group $1 Billion. Here’s Why.,by Philip van Doorn
2023-07-07 08:43:00,Chinese securities regulator fines Ant Group almost $1 billion for ‘illegal acts’: AFP,by Barron's
2023-07-07 07:38:00,"More than 216,000 global tech employees have lost their jobs since the start of 2023",by Barron's
2023-07-07 06:56:00,Levi Strauss slumps on outlook cut,by Barron's
2023-07-07 05:31:00,"Levi Strauss shares tumble on outlook cut, Mallinckrodt  and Alibaba shares rise and more stocks on the move",by Emily Bary
2023-06-30 08:04:00,"Alibaba Stock, JD.com Slip After China Reports Weak Economic Data",by Barron's
2023-06-29 07:16:00,"More than 211,000 global tech employees have lost their jobs since the start of 2023",by Wallace Witkowski
2023-06-28 20:27:00,Chinese Internet Stocks Slip on Report U.S. to Tighten AI Chip Exports,by Andrew Keshner
2023-06-28 10:22:00,Here are analysts’ 20 favorite AI stocks — and they still see upside for Nvidia,by Barron's
2023-06-27 15:09:00,Alibaba Stock Got Downgraded. It’s Rising Anyway.,by Barron's
2021-01-08 12:53:00,Alibaba Faces Scrutiny on Two Fronts: U.S. and China. Why Investors May Want to Wait to Bargain Hunt.,by Tomi Kilgore
2017-09-27 17:06:00,PayPal’s Most Likely Acquisition Targets,by Barbara Kollmeyer
2023-06-27 07:28:00,"Alibaba’s stock is ‘still very cheap,’ but Bernstein now wonders if it’s a value trap",by Barron's
2023-06-23 19:34:00,Why Charitable Giving Took a Rare Tumble in 2022,by Emily Bary
2023-06-21 08:38:00,Alibaba management shake-up positive as Zhang can now focus on cloud ahead of spinoff: analysts,by Barbara Kollmeyer
2023-06-20 16:28:00,Dow ends down 200 points as investors eye Powell’s comments Wednesday,by Barron's
2023-06-20 16:16:00,"These Stocks Moved the Most Today: Alibaba, Dice, Lemonade, Arcellx, Avis, and More",by James Rogers
2023-06-20 15:50:00,"Meet Joseph Tsai, the Sports Investor and Crypto Entrepreneur at the Top of Alibaba",by Barron's
2023-06-20 13:29:00,Nio’s stock turns briefly positive after more than $1 billion investment from Abu Dhabi fund,by James Rogers
2023-06-20 11:51:00,"Alibaba, Nio stocks fall, Rivian and Nikola shares rally and other stocks on the move",by Barron's
2023-06-20 08:47:00,Alibaba Stock Drops. It’s Shaking Up Top Management.,by Barron's
2023-06-20 05:30:00,"Alibaba’s Zhang to step down as CEO, chairman amid business shakeup",by Barron's
2023-06-19 10:04:00,"Alibaba, other tech stocks drop as Goldman downgrades China growth forecast",by James Rogers
2023-06-15 08:28:00,"Alibaba, Baidu, JD.com Rise After China’s Central Bank Cuts Another Interest Rate",by Barron's
2023-06-15 08:19:00,"Global tech layoffs have surpassed 206,000 since the start of 2023",by Ciara Linnane
2023-06-13 07:11:00,China’s Central Bank Cuts Rates. How It Helps Stocks and the Global Economy.,by James Rogers
2023-06-10 02:00:00,China’s AI Clout Might Be Overstated. What Investors Need to Know.,by Tomi Kilgore
2023-06-09 15:55:00,"More than 203,000 global tech employees have lost their jobs since the start of 2023",by Barron's
2023-06-09 05:02:00,China Stocks Mixed After Weak Inflation Data. Hopes Rise for More Stimulus.,by Barron's
2023-06-05 07:21:00,China Stocks Rise Again Amid PMIs and Stimulus Hopes. It Bodes Well for Alibaba.,by Barron's
2023-06-02 10:50:00,"China Stocks Jump on Stimulus Hopes. Alibaba, Baidu Rise.",by Tomi Kilgore
2023-06-02 07:51:00,"Global tech layoffs have surpassed 201,000 since the start of 2023",by Emily Bary
2023-05-31 10:38:00,Alibaba and Didi Stocks Are Moving After China’s Factory Slump Worsens,by Barron's
2023-05-31 08:13:00,Chinese ADRs slump premarket after weaker-than-expected manufacturing data,by Barron's
2023-05-26 14:24:00,"More than 199,000 tech-sector employees have lost their jobs since the start of 2023",by Barron's
2023-05-26 12:11:00,"Formerly Pinduoduo, PDD’s stock surge fuels broad bounce in U.S.-listed shares of China-based companies",by Emily Bary
2023-05-25 06:58:00,"Alibaba Leads China Stocks to Slump as Covid Fears Return, Risking Economic Rebound",by Barron's
2023-05-24 08:42:00,"Buying Alibaba Stock Was a ‘Mistake,’ Al Gore’s Firm Says",by Emily Bary
2023-05-23 11:07:00,Alibaba’s Prized Cloud and AI Arm Is Slashing Jobs. Brace for the IPO.,by Barron's
2023-05-23 06:17:00,Alibaba stock price target cut to $160 from $175 at Susquehanna,by Barron's
2023-05-20 08:31:00,Why Alibaba’s business shakeup isn’t helping its stock,by Emily Bary
2023-05-19 16:19:00,"These Stocks Moved the Most Today: Deere, Foot Locker, Morgan Stanley, Catalent, Applied Materials, and More",by Barron's
2023-05-19 09:13:00,Alibaba Stock Is Falling. The Breakup Bounce Has Faded.,by Barron's
2023-05-18 16:28:00,"These Stocks Moved the Most Today: Take-Two, Netflix, Walmart, Alibaba, and More Market Movers",by Barron's
2023-05-18 12:18:00,"Alibaba to spin out cloud business, but stock falls after earnings report",by MarketWatch
2023-05-18 09:49:00,Alibaba Earnings Take Backseat to Breakup. What It Plans to Spin Off.,by Tomi Kilgore
2023-05-18 06:54:00,Alibaba earnings: What to expect from the Chinese e-commerce giant,by Steve Goldstein
2023-05-17 02:00:00,Which Stocks Hedge Funds Bought—and Sold—During the First Quarter,by Tomi Kilgore
2023-05-16 08:48:00,Baidu Stock Rises After Solid Earnings. It Wasn’t AI That Drove the Beat.,by Barron's
2023-05-16 08:09:00,"Loeb’s Third Point buys up new stakes in Alibaba, AMD and Alphabet while dumping Disney’s stock",by Barron's
2023-05-14 15:00:00,"Walmart, Alibaba, Target, and More Stocks to Watch This Week",by Barron's
2023-05-14 08:00:00,"Giant Pension Sold Alibaba, Lululemon, and GE Stock. Here’s What It Bought.",by Joseph Adinolfi
2023-05-12 18:03:00,China Is in the AI Game. How Tech Giants Will Have to Play by Beijing’s Rules.,by Barron's
2023-05-11 13:40:00,"Disney, PacWest stocks fall, Robinhood, JD.com shares gain, and other stocks on the move",by Barron's
2023-05-11 12:58:00,"Alibaba and Nio stocks, and the ADS of other China-based companies get a boost after JD’s results",by Mike Murphy
2023-05-11 05:31:00,SoftBank touts leverage reduction after record loss in Vision Fund segment,by Anviksha Patel
2023-05-09 07:25:00,Alibaba stock price target cut to $145 from $155 at Mizuho,by Barron's
2023-04-27 06:36:00,Tech Stocks Are Offsetting Bank Turmoil. Why Something’s Got to Give.,by Barron's
2023-04-18 11:01:00,China’s GDP Beat Expectations. Alibaba and Baidu Are Rising.,by Anviksha Patel
2023-04-14 09:23:00,How China Is Boosting the World’s Richest Person’s Net Worth,by Barron's
2023-04-13 16:37:00,"Stocks That Moved the Most Today: Delta, Infosys, Sarepta, and More",by Barron's
2023-04-13 16:30:00,"S&P 500, Dow book highest close in 2 months on more signs of cooling inflation and ahead of bank earnings",by Barron's
2023-04-13 11:19:00,Why SoftBank Is Selling Alibaba Stock—and What It Means for China’s Tech Titan,by Barron's
2023-04-13 10:28:00,These 3 Stocks Are a Gateway to China’s Reopening. Alibaba Isn’t the Only Play.,by Barron's
2023-04-13 07:39:00,Alibaba shares fall as SoftBank reportedly sells most of its stake,by Emily Bary
2023-04-13 07:15:00,"Airline stocks, Alibaba climb premarket",by Emily Bary
2023-04-12 06:32:00,Good News for Alibaba and Other Chinese Stocks. UBS Sees 3 Reasons to Be Bullish.,by Barron's
2023-04-11 10:33:00,Alibaba Launched Its ChatGPT Rival. How Beijing Rained on the Parade.,by Barron's
2023-04-11 05:05:00,"Meet Tongyi Qianwen, Alibaba’s chatbot rival to ChatGPT",by Barron's
2023-04-04 11:23:00,China’s Recovery Should Help Alibaba’s Stock. Splitting Up Isn’t the Only Reason to Be Bullish.,by Barron's
2023-03-30 09:05:00,TikTok Won’t Be the Last Chinese Firm Targeted. Where the Next Fronts Might Be.,by Emily Bary
2018-05-14 09:52:00,Internet Stocks: Q1 Results Look Good for These 5 Companies,by Barron's
2023-03-31 10:07:00,JD.com Follows Alibaba’s Lead With Plans to Spin Off Units,by Anviksha Patel
2023-03-30 14:08:00,‘Big Short’ Investor Congratulates Market Dip Buyers. ‘I Was Wrong to Say Sell.’,by Emily Bary
2023-03-30 12:26:00,"Alibaba and JD.com shares gain amid spinoff potential, Roku’s stock falls after layoff news, and other stocks on the move",by Barron's
2023-03-30 12:03:00,Alibaba’s Cainiao logistics unit prepping for Hong Kong IPO: report,by Emily Bary
2023-03-30 10:23:00,"Alibaba May Be Splitting Up, but It Will Probably Keep the Good Parts for Itself",by Barron's
2023-03-29 16:28:00,"These Stocks Are Moving the Most Today: Micron, Lululemon, First Republic, UBS, Stratasys, and More",by Anviksha Patel
2023-03-29 14:48:00,Alibaba’s Breakup Plan Is a Hit for Now. Why China Is Still a Concern.,by Steve Gelsi
2023-03-29 13:03:00,Alibaba Stock Could Double. Splitting Up Fundamentally Changes the Valuation.,by Barron's
2023-03-29 12:04:00,"Lululemon and Micron shares surge, UBS’s stock rallies on CEO reinstatement and other stocks on the move",by Barron's
2023-03-29 08:46:00,Alibaba Is Laying the Ground for a Breakup. Amazon and Alphabet Should Do the Same.,by Barron's
2023-03-29 07:17:00,"Lululemon and Micron rise, Alibaba declines premarket",by Barron's
2023-03-28 23:33:00,Alibaba will reorganize into 6 units in the ‘ultimate value unlock’; stock soars,by Barron's
2023-03-28 16:09:00,"These Stocks Are Moving the Most Today: Alibaba, Virgin Orbit, Oscar Health, Carnival, Paramount, and More",by Ciara Linnane
2023-03-28 12:40:00,"Alibaba shares surge, Carnival’s stock rallies, and other stocks on the move",by Barron's
2023-03-28 11:51:00,Alibaba Stock Soars. An Unprecedented Shakeup Could Unlock Major Value.,by Barron's
2023-03-28 07:27:00,"Alibaba, First Republic rise premarket, Virgin Orbit falls",by Tomi Kilgore
2023-03-28 06:50:00,Alibaba stock up 6.6% in premarket trade on plan to form six units,by Tomi Kilgore
2023-03-27 14:54:00,A Mansion in Hong Kong’s Exclusive Peak Neighborhood Poised to Set a Price Record,by Barron's
2023-03-27 08:28:00,Jack Ma Returns to China. What It Means for Alibaba Stock.,by Barron's
2023-03-23 05:31:00,Tencent Leads Rally in Hong Kong. Tech Stocks Get a Boost From the Fed.,by Tomi Kilgore
2023-03-08 09:18:00,Alibaba Blockchain Deal Hints at Crypto Push,by Emily Bary
2023-03-06 16:55:00,China’s Latest Economic Plan Doesn’t Offer Much to Stock-Market Bulls,by Barron's
2023-03-06 11:06:00,"China stocks slip after growth target released, as Ciena shares pop on earnings beat",by Barron's
2023-03-03 17:27:00,China’s New Government Is Taking Shape. So Are Its Economic Policies.,by Emily Bary
2023-03-01 06:34:00,Alibaba and China Stocks Are Rallying. Chinese Growth Means Lockdown Pain Is in the Past.,by Barron's
2023-02-28 12:16:00,Alibaba Stock’s Recovery Has Momentum. This Is One Potential Risk.,by Barron's
2023-02-28 06:19:00,CORRECT: Alibaba stock price target cut to $175 from $185 at Susquehanna,by Bill Peters
2023-02-24 07:08:00,Alibaba stock price target raised to $130 from $120 at Truist,by Barron's
2023-02-23 17:48:00,Chinese Stocks Are a Big Risk. Russia and Taiwan Are the Reasons.,by Barron's
2023-02-23 16:21:00,"These Stocks Are Moving the Most Today: Nvidia, Domino’s Pizza, Wayfair, Lucid, and More",by Barron's
2023-02-23 10:53:00,"Alibaba’s and Nvidia’s stocks rise, Domino’s and Dollar General shares fall, and other stocks on the move",by Barron's
2023-02-23 10:27:00,Alibaba’s stock rallies after earnings beat as CEO says things are ‘getting back on track’,by Barron's
2023-02-23 10:25:00,Alibaba Stock Jumps After Earnings Beat. Chinese Lockdowns Still Weighed.,by Barron's
2023-02-23 08:34:00,China Restricts Access to ChatGPT: Report. These Stocks Plunge.,by Tanner Brown
2023-02-23 06:39:00,Alibaba stock heads higher after earnings beat,by Anviksha Patel
2023-02-20 18:06:00,"China Sets New Rules for Overseas IPOs. What It Means for DiDi, Alibaba, and Others.",by Barron's
2023-02-20 17:46:00,"Walmart, Alibaba, Moderna, and More Stocks to Watch This Week",by Barron's
2023-02-20 13:16:00,Just how bad were holiday sales? The world’s biggest retailers are about to tell us.,by Philip van Doorn
2023-02-19 08:00:00,"Al Gore’s Firm Sells Alibaba Stock, TSMC, and Shopify",by Barron's
2023-01-29 09:58:00,China’s Big Comeback Is Just Getting Started. How to Play It.,by Barron's
2023-02-18 10:53:00,"As Earnings Season Ends, Stocks Get Marked Down. The Good News: It Isn’t a Recession.",by Barron's
2023-02-17 09:39:00,A Highflying Chinese Financier Is Missing. Why It May Be a Warning for Alibaba.,by Barron's
2023-02-17 08:47:00,Buy Chinese Stocks? There Are Reasons for Caution.,by Barron's
2023-02-15 09:25:00,"‘Big Short’ Investor Michael Burry Bets on Alibaba and JD. This Time, Wall Street Agrees.",by Barron's
2023-02-15 07:51:00,"The AI chatbot phenomenon is now making waves in China, too",by Barron's
2023-02-15 06:49:00,Michael Burry and David Tepper snapped up Alibaba during the fourth quarter,by Barron's
2023-02-14 00:01:00,China’s Spy Balloon Could Bring Down Investors. Here’s How.,by Barron's
2023-02-13 15:19:00,The U.S. Blacklisted More Chinese Companies. The Big Ones Aren’t On the List.,by Barron's
2023-02-11 10:26:00,These 20 AI stocks are expected by analysts to rise up to 85% over the next year,by Barbara Kollmeyer
2023-02-10 10:52:00,JD.com Jumps on the AI Bandwagon. But It’s Not Helping the Stock.,by Anviksha Patel
2023-02-09 08:52:00,Alibaba and Baidu Want to Go Big in AI. China Might Not Let Them.,by Associated Press
2023-02-08 13:16:00,Alphabet Stock Falls. Microsoft’s Push Into AI Search Is a Threat.,by Barron's
2023-02-08 13:04:00,ChatGPT Is ‘What the Beatles Were to Music.’ Time to Look Through the Haze of AI Fever.,by Barron's
2023-02-08 10:26:00,Alibaba Is Joining the AI Race. It’s Developing a ChatGPT Rival.,by Ciara Linnane
2023-02-08 08:35:00,Can Activist Ryan Cohen Revive Nordstrom? His Past Investments Offer Clues.,by Anviksha Patel
2023-02-06 15:55:00,What the Spy Balloon Incident Means for the Rally in Chinese Stocks,by Barron's
2023-02-05 08:01:00,"Third-Largest U.S. Pension Sells Alibaba, TSMC, and MGM Stock. It Bought Harley-Davidson.",by Barron's
2023-02-03 18:30:00,The Pitfalls of Investing in China,by Barron's
2023-01-30 16:14:00,"These Stocks Moved the Most Today: Carvana, SoFi, AMC, Tesla, and More",by Barron's
2023-01-30 11:18:00,Alibaba Stock Falls. The Chinese E-Commerce Giant Says Speculation About HQ Move ‘Untrue.’,by Steve Goldstein
2023-01-30 09:37:00,"Things can only get better, says Citigroup about China travel trends",by Barron's
2023-01-30 07:30:00,Premarket movers and shakers,by Steve Goldstein
2023-01-30 03:01:00,"Asian shares mostly rise, but Hang Seng drops over 2% as Alibaba tumbles on reports of headquarter shift",by Barron's
2023-01-20 21:34:00,Activist Investors Will Keep Targeting Big Tech,by Steve Goldstein
2023-01-20 06:49:00,Markets Shrug at Debt Gridlock. Why the Impact Could Come Later This Year.,by Barron's
2023-01-18 08:08:00,Chinese have been snapping up flights abroad as Beijing puts zero-COVID restrictions in the rearview mirror and Chinese New Year nears,by Associated Press
2023-01-18 07:57:00,Optimism has been returning to China’s economy — but can it last?,by Christine Idzelis
2023-01-17 11:06:00,GameStop’s Cohen Is Going After Alibaba Stock. Why Meme Traders Won’t Follow.,by Barron's
2023-01-17 07:44:00,Bed Bath & Beyond down 6% in premarket trade amid bankruptcy fears,by Barron's
2023-01-17 06:19:00,Ryan Cohen takes stake in Alibaba: report,by Barron's
2023-01-16 11:48:00,Alibaba and Other Chinese Stocks Are Soaring as Tech Clampdown Eases,by Emily Bary
2023-01-16 11:29:00,Big Tech Stocks Could Rebound Big Time. Here’s How.,by William Watts
2023-01-16 06:31:00,"Credit Suisse, Just Eat, Alibaba, and More Market Movers",by Barron's
2023-01-13 10:02:00,"China Takes ‘Golden Shares’ in Alibaba, Tencent. It Wants Greater Role in Its Tech Sector.",by and Joseph Adinolfi
