timestamp,sentence,author
2020-07-20 09:59:00,"Why a Top World Stock Fund Likes Microsoft, Alibaba, and Johnson & Johnson",by Barron's
2020-07-17 12:26:00,"Alibaba Is a ‘Category Killer.’ Never Mind the Coronavirus, Analyst Says.",by Nigam Arora
2020-07-17 10:20:00,Intelsat's stock surges after David Tepper's Appaloosa disclosed new 2.1% stake,by Emily Bary
2020-07-17 07:52:00,"Alibaba, JD.com, and Other Chinese Stocks to Buy When Coronavirus Is Contained",by Barron's
2020-07-16 13:43:00,Stocks close lower amid rise in coronavirus outbreak,by Jeremy C. Owens
2020-07-16 08:17:00,"Alibaba Reported Strong Earnings, but Its CEO Called Coronavirus a ‘Black Swan Event’",by Barron's
2020-07-14 07:57:00,Alibaba earnings top expectations but coronavirus is having a ‘negative impact’ on the business,by Ciara Linnane
2020-07-14 06:00:00,"Money flows into tech stocks are stronger than ever, a possible contrarian indicator",by Jeremy C. Owens
2020-07-14 06:00:00,Alibaba Is Reporting Earnings on Thursday. Here’s What to Expect.,by Tonya Garcia
2020-07-13 17:43:00,Alibaba earnings preview: Coronavirus impact in focus,by Nigam Arora
2020-07-13 14:57:00,The earnings recession is expected to end after some big profit surprises,by Tanner Brown
2020-07-10 12:20:00,"Nvidia, Lyft, Alibaba, and Other Stocks for Investors to Watch This Week",by Jurica Dujmovic
2020-07-10 11:51:00,"New Jersey’s Pension Sold Apple, AT&T, and Microsoft Stock. Here’s What It’s Buying.",by Barron's
2020-07-08 16:43:00,China internet stocks get another boost on U.S. markets,by Barron's
2020-07-08 16:37:00,Snap earnings preview: Momentum is still on its side because of ad growth,by Barron's
2020-07-08 16:14:00,"Alibaba, Baidu among Chinese internet stocks rallying on U.S. markets",by Emily Bary
2020-07-07 14:31:00,"The Biggest U.S. Pension Bought Up Uber, Lyft, and Beyond Meat Stock Before They Rallied",by Emily Bary
2020-07-06 04:30:00,Alibaba Stock Looks Like a Buy on Coronavirus Fears,by Tomi Kilgore
2020-07-02 06:21:00,Emerging Markets Are the Next Hot Spot for Sustainable Investing,by Nigam Arora
2020-07-01 07:44:00,"Coronavirus is driving sales of face masks, a game called Plague, and an ‘I Survived Coronavirus 2020’ T-shirt",by Associated Press
2020-07-01 06:12:00,How Kobe Bryant pulled off the tricky pivot from sports to business — ‘I can’t think of another athlete who had a better transition’,by Mike Murphy
2020-06-30 16:51:00,"This money manager says growth stocks are still your best play, and he has the math to back it up",by Emily Bary
2020-06-29 11:07:00,The Dow Fell 26 Points Because Stocks Aren’t Going Anywhere For Now,by Nigam Arora
2020-06-25 10:35:00,5 Stocks That Could Pop as Coronavirus Fears Spread,by MarketWatch
2020-06-24 23:44:00,This is how far and fast the coronavirus has spread through U.S. stocks,by Barron's
2020-06-18 23:43:00,The biggest question looming over tech: Is the cloud boom over?,by Philip van Doorn
2020-06-18 00:46:00,China tech stocks fall amid virus concerns,by Emily Bary
2020-06-15 18:10:00,"For stocks and the economy, welcome to the Roaring Twenties",by Tanner Brown
2020-06-13 09:08:00,How Alibaba and Tencent Brought Mobile Payments to Chinese New Year,by Emily Bary
2020-06-12 13:13:00,"Tesla and Spotify Stock Could Soar Tenfold, James Anderson Says",by Philip van Doorn
2020-06-11 08:13:00,How Alibaba plans to improve the Olympics with cloud computing,by Barron's
2020-06-09 06:00:00,American Small Businesses Are Eager to Grow Online. Alibaba Wants to Help.,by Callum Keown
2020-06-06 12:03:00,Altaba Begins Sale of Remaining Stake in Alibaba,by Therese Poletti
2020-06-06 08:05:00,Saudi Aramco adds $3.8 billion to its record IPO,by Selin Bucak
2020-06-02 09:15:00,Something rare is happening among popular technology stocks,by Steve Goldstein
2020-05-29 16:18:00,"10 tech predictions for 2020: Apple, Tesla, Netflix and more",by Therese Poletti
2020-05-29 07:00:00,Amazon Is a Free-Cash Rocket Ship. Time to Get on Board.,by Barron's
2020-05-27 11:07:00,Microsoft Stock Soared in 2019. Here’s Why It Could Continue to Outperform This Year.,by Barron's
2020-05-26 15:08:00,Apple Starts 2020 With a Bang. Thank China.,by Tomi Kilgore
2020-05-26 06:12:00,Alibaba Stock Gains Are Lifting Altaba. Good Luck Cashing Out.,by Tomi Kilgore
2020-05-26 06:12:00,The five big China stories to watch in 2020,by Tomi Kilgore
2020-05-26 06:09:00,The Dow Rose 78 Points to a Record High Because Year-End Deals Cheered Up The Market,by Tomi Kilgore
2020-05-23 10:43:00,Alibaba Stock Closed at a Record High. It Still Has a Lot to Offer.,by Tomi Kilgore
2020-05-23 09:24:00,He has a degree in animal husbandry and a fortune that’s growing faster than any other on the Bloomberg Billionaire list,by Tomi Kilgore
2020-05-23 07:00:00,Alibaba Stock Still Has Lots of Room to Rise. Analyst Sees a 44% Gain.,by Barron's
2020-05-22 16:25:00,How Amazon created AWS and changed technology forever,by Sunny Oh
2020-05-22 13:25:00,"At $2.6 billion, the New York Mets would be the highest-valued sports team ever sold in the U.S.",by Barron's
2020-05-22 07:28:00,Saudi Aramco Has Eclipsed Apple. Size May Not Matter.,by Emily Bary
2020-05-22 07:22:00,"After WeWork Debacle, SoftBank Stock Is Now Too Cheap, Analyst Says",by Emily Bary
2020-05-22 07:21:00,Nvidia will dominate this crucial part of the AI market for at least the next two years,by Emily Bary
2020-05-22 07:16:00,"Charting a (very) early-month downturn, S&P 500 reverses from record highs",by Emily Bary
2020-05-22 07:15:00,The Aramco IPO Is Set to Become the World’s Largest. But Most of the World Isn’t Buying In.,by Nigam Arora
2020-05-22 07:14:00,Alibaba Had a Strong Hong Kong Debut. HSBC Says the Stock Is Still a Buy.,by Barron's
2020-05-22 07:12:00,Private-equity firm Silver Lake buys $500 million stake in Manchester City,by Emily Bary
2020-05-22 07:12:00,"U.S. stocks end at all-time highs, major indexes clinch 10th record close of November",by Emily Bary
2020-05-22 07:11:00,Alibaba Stock Surges on Impressive Hong Kong Debut,by Barron's
2020-05-21 14:25:00,The Trade War Will Make Stocks Scary. 5 Reasons Not to Panic.,by Barron's
2020-05-21 10:52:00,Alibaba shares jump 8% in debut on Hong Kong stock exchange,by Emily Bary
2020-05-21 10:47:00,The Chinese Vape Market Is Booming. But Heavy Regulation Is Coming.,by Jon Swartz
2020-05-20 16:33:00,SoftBank part of $1 billion investment in India mobile-payments startup Paytm,by Emily Bary
2020-05-20 13:43:00,"Best Buy, Alibaba, Deere and Other Stocks for Investors to Watch This Week",by Barron's
2020-05-20 12:58:00,You better believe the Fed is doing quantitative easing — and here are the beneficiaries,by Barron's
2020-05-20 09:27:00,Investing a dollar in each of these companies at their start would be worth millions now,by Barron's
2020-05-19 12:16:00,Trump May Exempt Apple From Tariffs and Other News From China You May Have Missed This Week,by Meera Jagannathan
2020-05-18 14:54:00,Alibaba raises $11 billion in Hong Kong secondary listing,by Andrew Keshner
2020-05-18 06:51:00,What China Slowdown? Alibaba Raises $13 Billion in Secondary Offering.,by Philip van Doorn
2020-05-18 05:10:00,Alibaba prices Hong Kong listing to raise as much as $12.9 billion,by Barron's
2020-05-17 15:00:00,Alibaba closes $13 billion Hong Kong share sale early,by Barron's
2020-05-16 10:05:00,The Dow Lost 102 Points Because Retail Earnings Were a Wipeout,by Tomi Kilgore
2020-05-15 08:42:00,What Does Alibaba’s Hong Kong Listing Mean for U.S. Shareholders? 6 Things to Know,by Therese Poletti
2020-05-15 07:00:00,"Aramco IPO seeks valuation up to $1.7 trillion, well short of original goal",by Emily Bary
2020-05-14 09:05:00,These highflying stocks hold big clues to a broader year-end rally,by Tomi Kilgore
2020-05-08 20:58:00,China’s JD.com Boosted by Surging Online Sales,by Peter Morici
2020-05-08 14:33:00,This number provides the most compelling reason to add emerging-market stocks to your portfolio,by Barron's
2020-05-08 06:09:00,Alibaba Is Moving Ahead With a Hong Kong Listing. It Plans to Sell 500 Million Shares.,by Associated Press
2020-05-07 10:55:00,Five Chinese startups you should know about,by Barron's
2020-05-01 11:50:00,Alibaba Stock Dropped After Jack Ma’s Comments on Singles Day Sales. Now the Company Is Clarifying What He Said.,by Barron's
2020-05-01 07:44:00,"Big Tech wants into your wallet so they can get more data, like their Chinese rivals",by Rory Jones
2020-05-01 06:07:00,Alibaba Stock Is Down Because Jack Ma Reportedly Was Disappointed With Singles Day Results,by Nigam Arora
2020-04-27 16:16:00,"Alibaba’s near–$15 billion listing in Hong Kong gets green light, sources say",by Daniel Newman
2020-04-20 14:57:00,Alibaba Stock Is Soaring. How to Get in On the Action With Options.,by Barron's
2020-04-20 10:31:00,"Singles Day — the Prime Day, or even Black Friday, of China — is driving billions in sales for Alibaba and JD.com",by Barron's
2020-04-20 10:26:00,What the Rising Tensions in Hong Kong Could Mean for U.S. Investors,by Barron's
2020-04-14 19:10:00,Alibaba Sold a Record Amount of Stuff on Singles Day. Apple and Lots of Other Brands Scored Too.,by Barron's
2020-04-13 06:28:00,Dow closes at record after Boeing surges on report of 737 Max early return,by Tanner Brown
2020-04-09 13:05:00,"Goldman Sachs and Apple Face Criticism Over Card, While Trade and Hong Kong Protest Drag  Down Stock Futures",by Barron's
2020-04-06 13:26:00,China’s Alibaba and JD.com report booming Singles Day sales,by Barron's
2020-04-05 23:04:00,"Monday Is Singles Day, the Biggest Shopping Day of the Year. Here’s What It Could Mean for Alibaba and China’s Economy",by Tonya Garcia
2020-03-26 07:38:00,Singles Day Is China’s Version of Black Friday—Just a Lot Bigger,by Shawn Langlois
2020-03-25 16:45:00,Alibaba Readies Up to $15 Billion Hong Kong Listing,by Barron's
2020-03-25 16:30:00,How the latest steps by Alipay and WeChat bring China closer to replacing cash with cellphones,by Jon Swartz
2020-03-24 13:20:00,SoftBank’s Quarterly Loss Was Its Biggest Ever. Blame WeWork and Uber.,by Weston Blasi
2020-03-20 20:30:00,Baidu Reports Earnings Tomorrow. Here’s What to Expect.,by Barron's
2020-03-18 07:34:00,"Bull trend confirmed: S&P 500, Nasdaq knife to uncharted territory",by Barron's
2020-03-13 20:35:00,"Bull trend confirmed: S&P 500, Nasdaq knife to uncharted territory",by Daniel Newman
2020-03-13 16:43:00,Alibaba Plans to Spend More in 2020. Why Wall Street Is Cheering.,by Michael Ashbaugh
2020-03-07 11:01:00,Credit cards have gone out of style in China — will the U.S. be far behind?,by Barron's
2020-03-04 08:46:00,Alibaba blows past earnings estimates and says it expects further cloud growth,by Barron's
2020-02-29 08:24:00,5 ways to beat the market — from a fund manager who’s done it for years,by Mike Murphy
2020-02-28 16:30:00,China Roundtable: 15 Stocks That Don’t Need a Trade Deal to Reward Investors,by Joy Wiltermuth
2020-02-27 11:08:00,"Facebook and Alphabet stocks in trouble over antitrust fears, warns Goldman",by Barron's
2020-02-27 08:21:00,Alibaba’s Revenue Jumped 40%. The Stock Is Rising.,by Barron's
2020-02-25 13:04:00,Starbucks gets personal with Deep Brew artificial intelligence program,by Associated Press
2020-02-22 14:17:00,Alibaba Reports Earnings Tomorrow. Here Is What to Expect.,by Newley Purnell
2020-02-22 10:19:00,SoftBank’s problems aren’t so surprising if you understand this one thing about the company,by Barron's
2020-02-19 18:38:00,"Jim Grant: Altria, SoftBank, and Their Divergent Paths",by Ivan Martchev
2020-02-18 16:08:00,"China Has Hundreds of Super-Start-Ups. For Now, They’re Playing a Waiting Game.",by Dave Ulrich
2020-02-18 10:00:00,Silicon Valley’s final frontier for payments: ‘The neoliberal takeover of the human body’,by Barron's
2020-02-18 08:12:00,Meg Whitman’s new venture is thinking big with a short-form streaming service,by Associated Press
2020-02-14 08:21:00,Why China’s TikTok has been drawing scrutiny from Zuckerberg and U.S. politicians,by Barron's
2020-02-14 07:44:00,"Momentum investors are now buying shares of Apple, Amazon and Netflix",by Steve Goldstein
2020-02-14 07:42:00,SoftBank Stock Has Fallen Hard on the WeWork News. Why One Analyst Says It’s Still Not a Buy.,by Serena Ng
2020-02-14 07:34:00,How to Position for Walmart Stock’s Next Big Move,by Barron's
2020-02-13 16:18:00,"Jack Ma shakes off tariff war to top China’s 2019 rich list, in latest survey",by Barron's
2020-02-13 16:12:00,"Rockets red glare: How Hong Kong protests became a political football for the Houston NBA team, its general manager and the league",by Ben Dummett
2020-02-13 12:05:00,Apple blasted by China’s state media for ‘unwise and reckless decision’ to allow apps that help Hong Kong protesters,by Barbara Kollmeyer
2020-02-13 10:28:00,The Dow Fell 314 Points Because China Is in a Bad Mood Ahead of Trade Talks,by Barron's
2020-02-13 06:54:00,"Dow falls 300 points, stocks end lower for second day as hopes for U.S.-China trade talks fade",by Philip van Doorn
2020-02-13 06:54:00,U.S.-China Trade Talks Keep Getting More Complicated. That’s Not Good for Investors.,by Barron's
2020-02-13 06:53:00,"Altaba, the Former Yahoo, Is Worth $10 Billion. Cashing Out Is Harder Now.",by Tanner Brown
2020-02-11 17:15:00,The NBA and China: What the Stock Market Thinks,by Barron's
2020-02-11 09:23:00,Walmart takes on Amazon in India with enhancements to Flipkart’s ‘Big Billion Days’,by Emily Bary
2020-02-11 07:59:00,Get into China stocks now before a relief rally begins,by Barron's
2020-02-10 06:48:00,Chinese Stocks Are Tumbling. Here’s Why Alibaba and Others Will Bounce Back.,by Stu Woo
2020-02-09 15:00:00,"Another alarm rings for the stock market, but there’s no reason to panic",by Barron's
2020-02-05 07:30:00,"Stocks finish higher as Dow, S&P 500 post gains for third straight quarter",by Tonya Garcia
2020-02-04 10:17:00,"Alibaba, Baidu stocks bounce after denial of plans to ban Chinese companies from listing in the U.S.",by Barron's
2020-02-04 08:41:00,"Alibaba Stock, Tencent Gain as U.S. Plays Down Report of Potential Delistings",by Barron's
2020-02-03 12:18:00,Trump’s plan to restrict U.S.-China investment: a negotiating ploy or harbinger of a longer-term battle?,by Sunny Oh
2020-02-01 07:30:00,"Amazon, Netflix and Apple shares are no longer beloved by the average investor",by Tomi Kilgore
2020-01-31 17:26:00,What investors need to know about a potential White House effort to block U.S. investment in China,by Tomi Kilgore
2020-01-31 07:00:00,Phantom Fears Take a Toll on Stocks,by Tomi Kilgore
2020-01-28 11:17:00,The Dow Fell 71 Points With the Latest China Twist,by Barron's
2020-01-28 09:48:00,Stocks close down as investors weigh potential curbs on U.S. portfolio investments into China,by Tomi Kilgore
2020-01-27 08:07:00,The Dow Is Down After Reports the U.S. Is Considering Delisting Chinese Stocks,by Associated Press
2020-01-23 17:34:00,Alibaba and Other China Stocks Plunge on Report White House Is Taking Aim,by Barron's
2020-01-23 11:59:00,Stock market hits session low amid report White House weighs limiting Chinese company access to U.S. exchanges,by Barron's
2020-01-21 14:47:00,"Huya, iQiyi, Nio, Luckin Coffee, Baidu and Pinduoduo move sharply lower on listing report",by Barron's
2020-01-21 11:22:00,China ETFs slump after report U.S. looking to limit U.S. portfolio flows,by Tanner Brown
2020-01-21 10:08:00,Alibaba Aims to Serve 1 Billion Customers a Year by 2024,by Barron's
2020-01-21 07:51:00,China and the U.S. Are Set to Talk Again. Here’s What to Buy If a Trade Deal Is Reached.,by Barron's
2020-01-18 12:10:00,"Buy These 3 Stocks to Ride the Global Shift to E-Commerce, Goldman Sachs Says",by Michael Ashbaugh
2020-01-17 19:34:00,Altaba Finally Rewards Its Shareholders. But the Ultimate Payoff Is Uncertain.,by Michael Ashbaugh
2020-01-17 17:11:00,China bursts bubble on digital-currency speculation,by Barron's
2020-01-15 16:04:00,"Nike Is Defying 2019’s Most Troublesome Trends—Tariffs, Amazon, and Global Sales",by Tomi Kilgore
2020-01-15 06:00:00,"Alibaba aiming for 1 billion annual active consumers by end 2024, more than $1.4 trillion in GMV",by Tomi Kilgore
2020-01-14 11:49:00,Alibaba Sails Into Investor Day Event With Strong Growth,by Elisabeth Buchwald
2020-01-12 20:38:00,"Charting a bull-trend pullback:  S&P, Dow retest the breakout point",by Emily Bary
2020-01-11 11:19:00,Investors Don’t Understand Alibaba Stock. Here’s How to Benefit.,by Michael Brush
2020-01-06 12:23:00,"An Obscure Post Office Meeting Begins Today. It Has High Stakes for UPS, Amazon, and Holiday Shoppers",by Barron's
2020-01-03 20:00:00,Alibaba Is Meeting With Investors Today. Here’s What to Expect.,by Callum Keown
2020-01-03 06:00:00,How to invest in — or avoid — what makes China China,by Barron's
2020-01-02 13:31:00,Never Mind Its WeWork Problem—SoftBank’s Stock Is Still Attractive,by Tonya Garcia
2019-12-24 07:32:00,The new technology that could turn small businesses into international companies,by Tomi Kilgore
2019-12-23 10:32:00,Starbucks launches voice ordering in China with Alibaba smart speaker,by Tomi Kilgore
2019-12-20 17:52:00,"Juul’s sales halted in China without explanation, days after launch",by Tomi Kilgore
2019-12-20 16:22:00,Oil Prices Can’t Make or Break Emerging Markets Anymore,by Tomi Kilgore
2019-12-20 11:47:00,"S&P 500 approaches uncharted territory, Tandem global-market rally accelerates",by Tomi Kilgore
2019-12-16 12:00:00,Alibaba founder Jack Ma steps down as chairman,by Tomi Kilgore
2019-12-09 12:41:00,"Buy Alibaba Now Ahead of Its Investor Day, Analyst Says",by Barron's
2019-12-07 09:38:00,Alibaba Bulks Up Import Ecommerce Operations With Buy of Netease Unit,by Koichiro Nakamura
2019-12-06 17:01:00,Altaba Payout to Shareholders Comes Up Short,by Barron's
2019-12-06 12:32:00,"Altaba declares distribution price as part of liquidation plan, which is less than original estimates",by Barron's
2019-12-04 10:37:00,Alibaba and NetEase strike a $2 billion deal and investment,by Quentin Fottrell
2019-12-03 10:29:00,Altaba Is Due to Announce Its First Payout Soon. It Could Be Time to Sell.,by Jon Swartz
2019-12-02 12:00:00,‘Shark Tank’ star Kevin O’Leary expects employees to work on vacation: ‘100%’,by Tanner Brown
2019-11-29 14:34:00,"Alibaba and Tencent Stocks Are Diverging. Here’s Which One to Buy, According to an Analyst.",by Nigam Arora
2019-11-27 13:32:00,"Elon Musk and Jack Ma agree: This existential threat is getting overlooked, and it’s not those killer robots",by Barron's
2019-11-27 09:23:00,"Before following Ray Dalio into China, ask yourself these questions",by Barron's
2019-11-26 16:47:00,Trump claims the stock market would be higher if he hadn’t confronted China — is he right?,by Associated Press
2019-11-26 11:26:00,Tech Stocks Swoon on President’s Demand to Pull Back From China,by Tanner Brown
2019-05-20 08:44:00,"Investors aren’t paying enough attention to this big risk lying in wait for stocks, says John Hancock strategist",by Barbara Kollmeyer
2019-11-26 01:30:00,Alibaba Reportedly Delays $15 Billion Hong Kong Listing as Protests Continue,by Barron's
2019-11-25 05:04:00,Alibaba to delay Hong Kong listing amid unrest: report,by Clive McKeef
2019-11-24 22:49:00,Here’s the game plan for U.S. stock investors if China retaliates against Trump,by Barron's
2019-11-24 15:00:00,Alibaba ADRs Are Rising Because of Strong Earnings. Here’s What Wall Street Thinks.,by Barron's
2019-11-23 13:03:00,Alibaba billionaire buys the Brooklyn Nets for U.S. pro sports record $2.35 billion,by Barron's
2019-11-22 14:59:00,"Podcast: An 11% Drop for GE Stock, and Two More Numbers to Know",by Tonya Garcia
2019-11-22 04:30:00,"U.S. stocks recover some ground, boosted by Walmart and retail sales",by Jeff Reeves
2019-11-20 22:47:00,Alibaba stock gets a boost after investment discipline draws cheers,by Barron's
2019-11-20 10:22:00,Beaten-down Nvidia is diligently preparing to pounce on its rivals,by Nigam Arora
2019-11-20 06:01:00,Alibaba Crushes Wall Street Expectations With 42% Revenue Gain,by Mark DeCambre
2019-11-19 19:13:00,"Forget the yield curve, here’s who will prevent the U.S. from entering a recession",by Tomi Kilgore
2019-11-19 17:43:00,Alibaba's stock surges after profit and revenue rise above expectations,by Barron's
2019-11-18 04:30:00,Alibaba Reports Earnings Today. Here’s What to Expect.,by Clive McKeef
2019-11-17 17:03:00,Alibaba co-founder to buy Brooklyn Nets for record $2.35 billion,by Nigam Arora
2019-11-16 13:28:00,Luckin Coffee Reports Earnings Today. Here’s What to Expect.,by Sunny Oh
2019-11-15 09:51:00,"Alibaba earnings: Cloud, B2B provide ‘insulation’ amid economic concerns",by Barron's
2019-11-15 06:55:00,The Dow Rallied After a Tariff Delay. Don’t Get Excited.,by Barron's
2019-11-14 19:40:00,These are the Chinese stocks analysts say you should buy,by Joy Wiltermuth
2019-11-14 14:38:00,JD.com Stock Is Jumping as the Chinese E-Commerce Company Posted Surprising Earnings,by Barron's
2019-11-14 07:16:00,Alibaba Stock Could Pop After Earnings. Here’s How to Play It With Options.,by Barron's
2019-11-14 12:48:00,"Walmart, Alibaba and some big-name pot companies keep earnings season rolling",by Mark DeCambre
2019-11-13 17:55:00,"Barrick Gold, Macy’s, Alibaba, and Other Stocks to Watch This Week",by Ciara Linnane
2019-11-13 08:29:00,Alibaba Is an Internet Stock for China’s Post-Growth Era,by MarketWatch
2019-11-12 09:24:00,China-sensitive stocks slide sharply as yuan move adds to trade-war fears,by Barron's
2019-11-12 07:45:00,A review of money flows in popular tech stocks could save you pain this earnings season,by Barron's
2019-11-11 17:35:00,Why Salesforce’s Partnership With Alibaba Makes Sense,by Barron's
2019-11-11 16:58:00,Alibaba Is Now Competing With Amazon on Its Home Turf. Wholesale Is the Start.,by Barron's
2019-11-11 16:24:00,China’s Consumers Have Driven Economic Growth. Here’s What to Watch to See If It Can Continue,by Tanner Brown
2019-11-11 14:30:00,"Charting a bullish reversal, U.S. benchmarks rally from near-term support",by Barron's
2019-11-11 14:29:00,Wall Street Has High Hopes for Alibaba’s Earnings. Analyst Argues the Bulls’ Case.,by Ciara Linnane
2019-11-11 14:28:00,Alibaba is expanding its commercial platform to U.S. small businesses,by Ciara Linnane
2019-11-11 08:52:00,The Biggest Investing Bet on Tech Is Cheap—and Controversial,by Ciara Linnane
2019-11-11 06:55:00,Bust these 3 myths before breaking up Big Tech,by Ciara Linnane
2019-11-11 06:15:00,Small Cities Are the Next Battleground for E-Commerce in China. Alibaba is Growing Fast There.,by Barron's
2019-11-09 08:01:00,Alibaba Stock Will Benefit from Strong Consumer Spending in China,by Michael Ashbaugh
2019-11-08 20:16:00,AB InBev's Asian unit sees lower-priced IPO,by Barron's
2019-11-08 14:26:00,IBM Completes Red Hat Deal — the Largest Software Acquisition Ever,by Barron's
2019-11-06 19:56:00,How Fund Managers Are Investing in China While Bracing for Conflict,by Barron's
2019-11-06 11:41:00,Fewer Chinese Companies Are Going Public in the U.S. What to Expect Next.,by Andrea Riquier
2019-11-05 06:15:00,How to Bet on Emerging Markets as Interest Rates Drop,by Barron's
2019-11-05 12:40:00,A Broadcom Stock Option Trade That Could Pay Off With a Trade War Truce — if You Can Take the Risk,by Emily Bary
2019-11-05 12:03:00,"6 China Internet Stocks to Buy and 3 to Sell, According to JPMorgan",by Tonya Garcia
2019-11-04 15:25:00,Goldman Sachs’s Italian job sparks anger at hedge fund get-together,by Jennifer Maloney
2019-11-04 07:55:00,"D.C. is finally paying attention to scary Chinese stocks, but Wall Street may pay the consequences",by Barron's
2019-11-04 07:54:00,Big Tech Companies Are Becoming Big Banks So a Global Regulator Wants  New Rules,by Michael Ashbaugh
2019-11-03 20:04:00,This fund manager goes his own way in China by looking beyond the trade spat,by Associated Press
2019-11-03 11:15:00,"The Dow Gains 354 Points Because a Trump Tweet and a Fed Meeting Means There’s Nothing to Worry About, Right?",by Barron's
2019-11-02 16:41:00,Alibaba Stock Gets a Boost From New Hong Kong Listing Plans,by Barron's
2019-11-01 17:28:00,"Starbucks Investors Don’t Need to Worry Much About Luckin Coffee, the ‘Starbucks of China’",by Barron's
2019-11-01 12:44:00,MoneyGram and blockchain company Ripple strike a deal that has MoneyGram stock jumping,by Tomi Kilgore
2019-11-01 11:09:00,Alibaba Stock Jumps After Proposing Stock Split Ahead of Hong Kong Listing,by Jeremy C. Owens
2019-11-01 07:52:00,The Dow Climbed Even After a Tanker Attack Sent Oil Prices Soaring,by MarketWatch
2019-11-01 07:14:00,"Alibaba Takes Another Step Toward a Hong Kong Listing, Reports Say",by Barron's
2019-11-01 07:13:00,"Alibaba confidentially files for Hong Kong listing, says Bloomberg",by Nicole Lyn Pesce
2019-11-01 07:11:00,Money flows in 11 popular tech stocks show that the rally is suspect,by Barron's
2019-11-01 07:11:00,Alibaba Stock Is ‘Attractive’ Even as Investors Grow Less Bullish,by Shawn Langlois
2019-11-01 07:10:00,"Alibaba investors are 'still bullish but slightly less so,' says UBS",by Brett Arends
2019-11-01 06:28:00,"Despite a Trade War, China’s Tencent and Alibaba Look Like Winners",by Nigam Arora
2019-10-31 05:30:00,Alibaba Stock Could Benefit From China’s Pivot to Domestic Consumers,by Barron's
2019-10-30 14:27:00,"Alibaba is 'insulated' from trade-war or macro issues, says Loop Capital",by Barbara Kollmeyer
2019-10-25 14:57:00,"U.S. could ‘get rolled’ in a trade war due to Big Tech regulation, says Druckenmiller",by Barron's
2019-10-25 13:00:00,Why a cautious Stanley Druckenmiller piled into Treasurys and Chinese tech,by Steve Goldstein
