timestamp,sentence,author
2022-04-25 08:29:00,"Alibaba, Bilibili shares lead sharp rally for Chinese internet stocks",by Barron's
2022-04-19 09:33:00,Alibaba Stock Is Soaring After Buyback Program Boosted to $25 Billion. Here’s Why.,by Tomi Kilgore
2022-04-11 16:33:00,Alibaba increases buyback program to $25 billion,by Barron's
2022-04-08 09:42:00,"Here’s what it will take to make stocks a ‘great’ buying opportunity, says this strategist",by Tomi Kilgore
2022-04-07 09:07:00,The S&P Experienced a Death Cross. Here’s the Bright Side.,by Barron's
2022-04-06 11:55:00,Alibaba and Other Chinese Stocks Could Get Delisted. What That Means for China Funds.,by Barron's
2022-04-06 09:00:00,Alibaba and JD.com Stocks Are Dropping a Day After Their Largest Gains Ever. What Now?,by Barron's
2022-04-04 13:57:00,"The S&P 500 Slipped, Alibaba  Tumbled—and What Else Happened in the Stock Market Today",by Emily Bary
2022-04-04 08:49:00,"Dow books 500-point gain after Fed raises interest rates for first time in 4 years, signals more to come",by Barron's
2022-04-01 08:22:00,Alibaba and JD.com Head for Record Gains. What Sparked the Turnaround for Chinese Stocks.,by Barron's
2022-04-01 06:31:00,Here’s why popular China ETFs are on track for their best one-day gain in history,by Tomi Kilgore
2022-03-31 12:31:00,How an Emerging Asia Stock Fund Avoids One-Hit Wonders,by Barron's
2022-03-30 10:31:00,Alibaba and JD.com soar as China pledges to support markets,by Barron's
2022-03-25 11:26:00,"Dow Surges 600 Points, Oil Falls, Bond Yields Pause—and What Else Happened in the Stock Market Today",by Tomi Kilgore
2022-03-24 13:09:00,Alibaba Stock Is Really Hurting. Why It Might Not Bounce Back Anytime Soon.,by Emily Bary
2022-03-24 06:26:00,"Alibaba stock keeps sinking toward a 6-year low, Nio stock also dives as Chinese ADRs continue selloff",by Barron's
2022-03-22 16:23:00,"Alibaba, JD.com, and Tencent Tumble. Why Chinese Stocks Are Under Pressure.",by Mark DeCambre
2022-03-22 12:45:00,Alibaba stock sinks toward 6-year low as China ADRs take another dive,by Emily Bary
2022-03-22 10:37:00,Alibaba and Other Chinese Stocks Are Tumbling. Why It’s Not a Buying Opportunity.,by Emily Bary
2022-03-22 08:43:00,Why Alibaba and Other Chinese Stocks Could Face More Delisting Threats,by Barron's
2022-03-21 20:25:00,Alibaba and Other Chinese Stocks Got Crushed Thursday. Here’s Why.,by Barron's
2022-03-21 09:43:00,U.S.-listed China stocks sink as jitters build about overseas listings,by Barron's
2022-03-18 20:14:00,Why Alibaba Is the ‘Cheapest Company in the World’ Outside Russia,by Barron's
2022-03-18 07:36:00,Metaverse Fever Is High in China. Regulators Are Watching.,by Barron's
2022-03-17 13:09:00,"Competition Is Heating Up in Covid Boosters. Moderna and Pfizer, Take Heed.",by Barron's
2022-03-17 11:39:00,Alibaba Stock Is in the Dumps. Here Are 2 Requirements for a Turnaround.,by Steve Goldstein
2022-03-16 16:33:00,Alibaba shares decline as earnings show slowing e-commerce growth,by Barron's
2022-03-16 10:57:00,Alibaba Earnings Aren’t Bad but the Stock Is Plunging. Here’s What to Like.,by Barron's
2022-03-16 10:55:00,"Swallow your fear and prepare for a ‘relief rally,’ says analyst, as Russia invasion in Ukraine sparks stock-market maelstrom",by Barron's
2022-03-16 05:30:00,Alibaba shares drop after mixed earnings report,by Weston Blasi
2022-03-16 05:28:00,Alibaba earnings to come amid macro pressures on Chinese e-commerce,by Tomi Kilgore
2022-03-15 16:17:00,Alibaba’s Quarterly Profit Is Set to Plummet 60%. Here’s Why.,by Barron's
2022-03-15 10:31:00,"Moderna, Alibaba, Coinbase, Home Depot, Etsy, and Other Stocks to Watch This Week",by Barron's
2022-03-15 09:11:00,Al Gore’s Investment Firm Sold Alibaba and Cisco Stock. It Bought Visa and Microchip.,by Barron's
2022-03-14 08:58:00,"Alibaba Stock and Tencent Are Tumbling. This Time, Blame the Metaverse.",by Tomi Kilgore
2022-03-14 07:02:00,Virgin Galactic Invites the Public to a $450K Space Jaunt,by Tomi Kilgore
2022-03-11 13:40:00,Alibaba and Tencent E-Commerce Sites Added to U.S. Counterfeit and Piracy List,by Barron's
2022-03-11 13:09:00,Ray Dalio’s Bridgewater boosts its bets on China,by Tomi Kilgore
2022-03-10 19:40:00,"Giant Pension Exited Alibaba and Bought Coinbase, Lucid, and Rivian Stock",by Tomi Kilgore
2022-03-10 13:26:00,Alibaba Earnings Are Coming. 4 Numbers to Watch.,by Barron's
2022-03-04 11:43:00,SoftBank Earnings Plunge in Growth Stock Selloff,by Barron's
2022-03-04 09:18:00,NBC’s Mike Tirico tackles ‘sportswashing’ and China’s treatment of Uyghur Muslims,by Tomi Kilgore
2022-02-28 06:17:00,Alibaba Stock Is Falling. SoftBank May Be Getting Ready to Sell Its Huge Stake.,by Barron's
2022-02-25 21:09:00,"Bitcoin Has No Inherent Value and Cryptos Could Be a ‘Speculative Mania,’ Economist Says",by Barron's
2022-02-25 08:51:00,These Were 2021’s Winning—and Losing—Short Sales,by Barron's
2022-02-25 07:03:00,Alibaba Stock and JD.com Are Outperforming Apple and Tesla. Here’s Why.,by Tomi Kilgore
2022-02-24 15:01:00,Alibaba stock surges as interest rate cut in China fuels broad rally,by Barron's
2022-02-24 09:10:00,Alibaba and Other Chinese Internet Stocks Look Cheap. But Regulators May Not Be Done Yet.,by Tomi Kilgore
2022-02-24 08:42:00,Alibaba Faces Near-Term Headwinds. Why the Stock Could Be a Long-Term Winner.,by Barron's
2022-02-24 07:30:00,What PayPal Can Learn from Alibaba and Tencent,by Barron's
2022-02-23 15:17:00,Alibaba Stock May See Its Worst Day This Year. Here Are Two Reasons Why.,by Tomi Kilgore
2022-02-23 08:43:00,Alibaba Stock Is Headed for Its Biggest Drop of the Year,by Emily Bary
2022-02-22 04:53:00,"Alibaba, JD.com, and Other Chinese Tech Stocks Are Soaring. Here’s Why—and Who to Thank.",by Barron's
2022-02-22 03:30:00,Alibaba Stock Gets a Target Price Cut. Here’s Why It’s Still a Buy.,by Tomi Kilgore
2022-02-21 09:51:00,Alibaba Stock Is on a Tear. Here Are 5 Reasons Investors Are Buying the Dip.,by Barron's
2022-02-18 20:29:00,"Alibaba’s ‘long-term strategy is intact,’ analyst says as stock rises",by Barron's
2022-02-18 07:46:00,Alibaba Stock Rises Despite Tech’s Tumble and a Price Target Cut. Here’s Why.,by Barron's
2022-02-15 05:06:00,Charlie Munger’s Firm Doubles Down on Alibaba Investment. Again.,by Associated Press
2022-02-13 07:00:00,U.S.-Listed Shares of Alibaba and JD.com Slip After Huge Rally in Chinese Tech Giants,by Barron's
2022-02-11 13:12:00,Didi’s revenue slumps after crackdown by Chinese government,by Mark DeCambre
2022-02-08 11:44:00,Alibaba Stock Is Falling. The Shares Could End 2021 at a Year Low.,by Tomi Kilgore
2022-02-07 11:12:00,"China pursues ‘self-reliance’ in making chips, fueling global unease",by Therese Poletti
2022-02-07 09:02:00,China Issued New Rules for Overseas Listings. Alibaba Stock Fell.,by Barron's
2022-02-07 08:22:00,"Dow rises over 350 points, S&P 500 logs 69th record of 2021 as holiday spending buttresses stock market Monday",by Wallace Witkowski
2022-02-04 15:49:00,Alibaba stock rises in wake of China regulator's draft rules on overseas listings,by Barron's
2022-01-28 03:00:00,"Chinese stocks cut $600 billion from U.S. markets in 2021, and are just getting started",by Barron's
2022-01-26 07:17:00,"Alibaba’s Stock Is Cheap, but for Good Reason. Investors Should Be Wary.",by Barron's
2022-01-26 06:40:00,Alibaba stock drops as China regulator reportedly suspends partnership,by Associated Press
2022-01-20 09:49:00,Alibaba Stock Is Irresistibly Cheap. Investors Might Want to Hold Off.,by Associated Press
2022-01-20 07:26:00,Alibaba Sets $100 Billion Target for Southeast Asian E-Commerce Unit,by Barron's
2022-01-20 06:52:00,China’s Anti-Monopoly Crackdown Is Just an Excuse,by Barron's
2022-01-19 14:41:00,Global race to patch critical computer bug in open source software used by Apache servers,by Barron's
2022-01-19 13:36:00,Chinese leaders promise more economic support after slowdown,by Barron's
2022-01-19 07:51:00,Alibaba Stock Looks Like a Screaming Buy. Is It Really?,by Barron's
2017-09-26 17:59:00,Could China Be the Next South Africa? Big Investors Are Pressed Over Human Rights.,by Barron's
2022-01-18 10:19:00,What Happens When Stocks Delist? What to Know if You Own DiDi.,by Emily Bary
2022-01-13 10:07:00,Alibaba Stock’s Two-Day Rally Looks Like a Head Fake. The Stock Is Falling Again.,by Barron's
2022-01-13 06:14:00,Alibaba Stock Had Its Best Day in 4 Years. Why It’s Rising Again.,by Steve Goldstein
2022-01-12 09:13:00,List of Concerns Over China’s Stocks Grows Longer,by Associated Press
2022-01-12 06:17:00,Alibaba stock rockets to best day since 2017,by Claudia Assis
2022-01-10 08:15:00,Alibaba Stock Is Rising. The E-Commerce Giant Shook Up Management.,by Barron's
2022-01-07 18:24:00,"Crypto has had a rough few days. The biggest test is still to come, Morgan Stanley strategists say.",by Barron's
2022-01-07 06:44:00,Alibaba reshuffles e-commerce team and names new CFO,by Barron's
2022-01-06 14:06:00,Asian markets mixed after China Evergrande warns of cash woes,by Barron's
2022-01-06 09:28:00,"Nio, Alibaba lead losses for U.S.-listed stocks of Chinese companies after Didi delisting news",by Barron's
2022-01-06 06:43:00,MSCI Now Tracks Hong Kong Shares of JD.Com and NetEase. That’s a Shift in Liquidity From U.S. for Chinese Stocks.,by Tomi Kilgore
2022-01-05 03:15:00,Alibaba Stock Keeps Falling as Delisting Concerns Mount. Here’s What to Know.,by Barron's
2021-12-31 12:30:00,Didi’s Dramatic Delisting Rings Alarm Bells for Alibaba and Others,by Tomi Kilgore
2021-12-29 22:54:00,Vanguard Is Making a Play on China With Its First Single-Country Fund,by Tomi Kilgore
2021-12-29 10:30:00,Alibaba Stock Hits 4-Year Low. Goldman Sachs Maps Out How the Stock Can Rise—or Fall.,by Barron's
2021-12-27 22:47:00,Al Gore’s Firm Bought Intel and Alibaba Stock. It Sold Texas Instruments.,by Barron's
2021-12-27 17:14:00,Alibaba Stock Price Target Cut Again as More Analysts Smile on Rival JD.com,by Barron's
2021-12-27 16:52:00,"Alibaba stock just suffered the biggest 5-day selloff in its history, but Susquehanna analyst stays ‘positive’",by Emily Bary
2021-12-27 10:33:00,Alibaba Stock Gets More Price Target Cuts. But There Are Reasons to Be Bullish.,by Associated Press
2021-12-24 07:28:00,Alibaba Stock Is Near 3-Year Lows. Why One Analyst Prefers Its Competitor.,by Tomi Kilgore
2021-12-23 21:05:00,Alibaba Stock and Others Fall After New Chinese Scrutiny. Why the Worst May Be Over.,by Barron's
2021-12-22 13:00:00,China’s Transition Is Risky for Investors. 13 Picks From Our International Roundtable.,by Tomi Kilgore
2021-12-19 10:38:00,Alibaba stock slide continues: Analyst sees ‘few near-term positive catalysts’ but upcoming event could reset expectations,by Tomi Kilgore
2021-12-17 08:42:00,China fines tech giants over anti-monopoly violations again,by Barron's
2021-12-15 05:00:00,Alibaba Stock Plunges in Hong Kong on Growth Fears,by Emily Bary
2021-12-10 15:09:00,Tech Stocks Are Carrying the S&P 500. Alibaba’s Slump Offers a Warning.,by Tomi Kilgore
2021-12-10 13:26:00,Alibaba Stock Is Tumbling After a Bad Earnings Miss and Slashed Sales Outlook,by Tomi Kilgore
2021-12-10 07:02:00,"Alibaba stock heads for worst day in 11 months after earnings fall short, company cuts forecast",by Tomi Kilgore
2021-12-10 05:30:00,Warren Buffett-Backed Paytm Stock Collapses After India’s Largest-Ever IPO,by Tomi Kilgore
2021-12-09 00:01:00,Alibaba-led consortium poised for $8 billion deal for China chip giant Tsinghua: report,by Tomi Kilgore
2021-12-08 13:21:00,Luxury in the metaverse? Morgan Stanley says it could become a €50 billion market,by Tomi Kilgore
2021-12-07 08:35:00,All Eyes on Infrastructure,by Barron's
2021-12-07 08:18:00,Giant Pension Doubled Down on NIO Stock. It Sold These Three Stocks.,by Barbara Kollmeyer
2021-12-06 16:53:00,"Nvidia, Walmart, Alibaba, Lucid, and Other Stocks to Watch This Week",by Steve Goldstein
2021-12-06 11:34:00,"Shell’s Pension Dropped Alibaba, Sold Pfizer, J&J, and Merck Stock",by Barron's
2021-12-06 08:30:00,Alibaba’s Singles Day Sales Smash Records. But Will the Stock Beat History?,by Barron's
2021-12-06 04:47:00,"Alibaba, JD.com shares rise as Singles Day comes to a close",by Barron's
2021-12-05 23:57:00,Chinese shoppers spend $139 billion during Singles’ Day fest,by Barron's
2021-12-03 14:49:00,Alibaba and JD.com Rise on Singles Day. Black Friday in China Was a Success.,by Emily Bary
2021-12-03 11:01:00,"A Huge Pension Sold Netflix, Bank of America, and Intel Stock. Here’s What It Bought.",by Associated Press
2021-12-03 10:44:00,"University of California Increased Alibaba, Pinduoduo Stock Investments",by Barron's
2021-12-03 06:43:00,Here’s what it will take to resolve the supply-chain disruptions roiling the U.S. economy,by Barron's
2021-11-29 16:42:00,Chinese Stocks Get Reprieve as Evergrande Avoids Default. Why Investors Still Need to Look for Trouble Ahead.,by Barron's
2021-11-29 12:19:00,Alibaba Stock Keeps Rising as Founder Jack Ma Reportedly Visits Europe,by Steve Goldstein
2021-11-28 07:00:00,"Alibaba Unveils In-House Chip to Boost Cloud Services. Amazon, Microsoft Beware.",by Tomi Kilgore
2021-11-25 06:59:00,These fund managers have found the key to winning ‘quality’ stocks — and these are the ones they own,by Barron's
2021-11-24 14:36:00,Alibaba Stock Is Rebounding. It’s Not Time to Buy.,by Barron's
2021-11-24 09:03:00,"China to probe ties between financial institutions, regulators and private firms including Alibaba’s Ant",by Barron's
2021-11-24 07:43:00,Alibaba stock surges toward 5th straight gain as part of broad rally in China-based tech stocks,by Philip van Doorn
2021-11-24 06:07:00,Charlie Munger’s Firm Doubled Down on Its Alibaba Investment,by Barron's
2021-11-23 19:02:00,Alibaba Stock Just Had Its Best Day in 4 Years. Here’s What It’s Doing Today.,by Lingling Wei
2021-11-22 08:10:00,There’s a lesson from Charlie Munger’s increased bet on Alibaba,by Tomi Kilgore
2021-11-22 07:55:00,Alibaba Is Having Its Best Day In 4 Years. Why Investors May Still Want to Be Wary.,by Barron's
2021-11-20 12:48:00,China’s Communist Party exerting tighter control over the country’s internet giants,by Barron's
2021-11-20 12:00:00,Alibaba loses its 'strong buy' rating at Raymond James amid concerns about e-commerce growth,by Steve Goldstein
2021-11-19 08:44:00,China’s Next Bull Market Is Coming. How to Prepare.,by Barron's
2021-11-19 06:49:00,"Xi Jinping Grasps for Power, Even if It Means Hurting Business",by Tomi Kilgore
2021-11-19 06:35:00,"America’s policy toward China is misdirected, because it would actually strengthen China and weaken the United States",by Tomi Kilgore
2021-11-19 06:34:00,Chinese E-Commerce Giant Alibaba Held Its Annual Meeting Friday. The Stock Is Up.,by Associated Press
2021-11-19 06:28:00,Alibaba Invests in Chinese Self-Driving Unicorn in Latest Electric Vehicle Move,by Emily Bary
2021-11-18 12:31:00,"Dow, S&P 500 snap 5-session skid Monday as blue-chip index books best day in about 5 weeks",by Tonya Garcia
2021-11-18 10:03:00,Bargain Hunters in China Are Facing Setbacks. Here Are the Latest Pain Points.,by Barron's
2021-11-18 06:33:00,"Ant Group’s Alipay Is Set to Be Broken Up, According to Reports",by Barron's
2021-11-18 06:32:00,Chinese regulators look to break up Ant Group’s Alipay: report,by Chang-Tai Hsieh
2021-11-18 06:31:00,These robotics and automation stocks could climb up to 68% in the next year,by Barron's
2021-11-18 06:28:00,Alibaba Donates a Third of Its Cash to Chinese Initiatives. The Stock Is Falling.,by Tomi Kilgore
2021-11-18 06:27:00,Alibaba stock extends corrective bounce after pledge to spend $15.5 billion for 'common prosperity' amid regulatory scrutiny,by Tomi Kilgore
2021-11-18 06:27:00,"Didi, Alibaba, and Meituan Are Under Scrutiny in China, Again. Why the Stocks Shrugged.",by Barron's
2021-11-18 05:51:00,Investors Are Running Scared From China’s Stocks. Where to Find Opportunities.,by Joy Wiltermuth
2021-11-17 03:35:00,"Alibaba, CrowdStrike Set to Open Higher— And What Else Is Happening in the Stock Market Today",by Barron's
2021-11-16 09:38:00,"Alibaba, JD.com, Pinduoduo shares post strong rallies after rough stretch for China internet stocks",by Barron's
2021-11-15 08:00:00,Alibaba and Other Chinese Tech Stocks Are Rallying. Cathie Wood Is Back in the Game.,by Mike Murphy
2021-11-15 07:00:00,Al Gore’s Investment Firm Made Big Bets in Alibaba and Intel Stock,by Philip van Doorn
2021-11-14 22:04:00,"China Adopts New Privacy Law,  Sending Tech Stocks Tanking",by Barron's
2021-11-13 07:00:00,New Chinese law tightens control over company data on users,by Tomi Kilgore
2021-11-12 11:22:00,"Dow, S&P 500 snap run of record highs as stocks end lower after disappointing retail sales",by Barron's
2021-11-12 08:29:00,Tencent Music Earnings Beat Expectations. Why the Stock Is Tumbling.,by Barron's
2021-11-11 14:10:00,Alibaba stock heads for lowest close since October 2019 amid pressure on China’s tech sector,by Barron's
2021-11-11 09:46:00,China Tightens Grip on Its Tech Sector With New Rules. These Stocks Are Down.,by Emily Bary
2021-10-31 07:00:00,Alibaba Stock Has Tumbled to a Pandemic Low. Why It Needs to Make a Stand.,by Barron's
2021-10-30 07:00:00,"Alibaba Is Falling, Tesla Is Dropping — and What Else Is Happening in the Stock Market Tuesday",by Barron's
2021-10-27 08:33:00,"If you’re nervous about the stock market at record highs, consider these five companies that are loved by the smart money",by Barron's
2021-10-25 07:04:00,Alibaba Is Having Its #MeToo Moment. What It Means for China’s Tech Stocks.,by Associated Press
2021-10-22 13:33:00,Earnings Slump at Softbank but It Shrugs Off the Chinese Crackdown–for Now,by William Watts
2021-10-20 08:43:00,SoftBank Earnings Show Large Profit Slide. Here’s What Happened.,by Barron's
2021-10-19 07:50:00,Alibaba working with police in China amid employee’s allegations of sexual assault,by Emily Bary
2021-10-16 10:11:00,China regulators near $1 billion fine on food-delivery giant Meituan,by Barron's
2021-10-12 08:24:00,Alibaba Earnings Were Pretty Good. Why the Stock Has Dropped — Just Like Amazon Did.,by Barron's
2021-10-12 02:03:00,Why This Longtime Asia Investor Thinks the Reaction to China’s Crackdown Is Overblown,by Barron's
2021-10-11 06:51:00,"Alibaba tops profit expectations, boosts buyback program",by Michael Brush
2021-10-10 20:11:00,"Videogames entered the mainstream for good in the pandemic, but the industry faces a rough transition",by Barron's
2021-10-08 10:40:00,"Alibaba stock has taken a hit from China crackdown, but its earnings could be a different story",by Barron's
2021-10-08 08:43:00,"Uber, DraftKings, GM, ViacomCBS, and Other Stocks to Watch This Week",by Associated Press
2021-10-07 11:43:00,Which ETFs will Robinhood’s buzzy stock find itself in and when?,by Keith Zhai
2021-10-07 08:48:00,"A Giant Fund Scooped Up AMC Stock, Bought More Tilray and Carnival",by Tomi Kilgore
2021-10-04 06:35:00,"GE Has a No-Drama Earnings Beat, Powered by Its Free Cash Flow",by Tomi Kilgore
2021-10-04 00:01:00,Cathie Wood’s ARK Innovation ETF Has Sold Nearly All Its Chinese Stocks,by Tomi Kilgore
2021-10-01 09:04:00,Expect More Crackdowns From China—and Risks for Investors,by Barron's
2021-10-01 07:33:00,"Altaba, the Former Yahoo, Is Making a $3.9 Billion Distribution to Holders",by Barron's
2021-09-29 12:44:00,Hang Seng down 5% in late trade as tech selloff intensifies,by Emily Bary
2021-09-28 06:30:00,"With a cost of over $20 billion and decreased revenue due to no fans, how many billions will Tokyo lose on the Olympics?",by Tomi Kilgore
2021-09-20 15:06:00,"China cracks down on after-school tutoring sector, sending shares sinking",by Tomi Kilgore
2021-09-17 09:25:00,China’s Tencent ordered to end exclusive music contracts,by Tomi Kilgore
2021-09-17 07:15:00,This is your final warning — Chinese stocks listed in the U.S. are dangerous to hold,by Tomi Kilgore
2021-09-15 06:38:00,Didi shares slide 3.3% premarket on report Chinese government mulling serious penalties for U.S. IPO,by Tomi Kilgore
2021-09-14 12:27:00,Alibaba and Tencent Working Together? Analysts Say One Could Have an Edge.,by Wallace Witkowski
2021-09-13 16:31:00,Alibaba and Tencent consider opening up their ‘walled gardens’,by Emily Bary
2021-09-13 15:16:00,"China Regulatory Pressures, U.S. Tensions Create New Winners and Losers",by Barron's
2021-09-13 15:09:00,"No fans at the Tokyo Olympics will lead to at least $800 million in ticket-sale losses, analyst says",by Mark DeCambre
2021-09-12 21:10:00,Chinese regulator halts Huya-Douyu game-streaming merger,by Barron's
2021-09-04 10:02:00,ETFs set to smash a 2020 record of $504 billion net inflows and it’s only July,by Barron's
2021-09-03 07:30:00,China tries to quell investor fears about internet companies,by Tomi Kilgore
2021-09-02 10:20:00,Beijing’s Regulatory Plans Could Hurt U.S.-Listed Chinese Companies. The Pitfalls Investors Need to Know.,by Barron's
2021-09-02 09:56:00,"Amazon is the world’s most valuable brand, but Alibaba and Facebook have better financials",by Barron's
2021-08-30 07:31:00,"Buy these 6 types of stocks next as Big Tech falters and inflation falls, says Swiss bank UBS.",by Barron's
2021-08-24 10:53:00,"Alibaba, Alphabet, and Amazon Stock Are Bargains, This Value Manager Says. Here’s Why.",by Steve Goldstein
2021-08-24 10:51:00,China’s Regulators Are Targeting Internet Giants. These 7 China Funds Aren’t Loaded Up in These Stocks.,by Weston Blasi
2021-08-24 08:16:00,Al Gore’s Firm Doubled Down on Alibaba. It Sold Airbnb and One Chip Stock.,by Chong Koh Ping
2021-08-21 07:00:00,"Largest U.S. Pension Slashed Positions in Alibaba, Palantir, and GameStop. Here’s What It Bought.",by Associated Press
2021-08-20 08:52:00,The Race Is On for Superapp Supremacy in Southeast Asia. What to Know.,by Therese Poletti
2021-08-20 08:07:00,Why Alibaba’s Slumping Stock May Not Be a Bargain Yet,by Ciara Linnane
2021-08-17 16:28:00,Alibaba Swings to a Loss as Revenue Beats Forecasts,by Barron's
2021-08-17 14:55:00,Alibaba posts loss due to anti-monopoly fine but beats revenue expectations,by Barron's
2021-08-17 14:07:00,A Large Fund Bet Big on Apple and Alibaba Stock. Here Are Two Stocks It Sold.,by Weston Blasi
2021-08-17 13:42:00,"It Took a While, But Buffett Confirms: He Has a Successor",by Associated Press
2021-08-17 13:22:00,"If you want to own international stocks, invest in these three countries instead of China",by Mark DeCambre
2021-08-17 10:08:00,Meituan Is Latest Chinese E-Commerce Giant in Antitrust Crackdown,by Associated Press
2021-08-14 09:38:00,Tesla Stock and Apple Were Bought By a Big Investor. It Sold Alibaba and XPeng.,by Barron's
2021-08-13 11:30:00,China Is Betting Big on Its Digital Currency. What It Means for Alibaba and Tencent.,by Tomi Kilgore
2021-08-10 06:38:00,"Ant Group Ponders Future Without Jack Ma, Report Says",by Philip van Doorn
2021-08-10 06:36:00,Jane Fraser’s Debut as Citi’s CEO Hits All the Right Notes,by Jack Denton
2021-08-08 16:40:00,China Cracked Down on Its Internet Giants. The Rebound Will Be Slow.,by Barron's
2021-08-06 06:07:00,How Big Tech’s disruption of finance is a threat to us all,by Barron's
2021-08-05 06:23:00,Alibaba’s Core Commerce Business Is Back In Focus,by Barron's
2021-08-04 06:22:00,Alibaba Can Now Put Record Antitrust Fine Behind It. Analysts Expect the Stock to Rise.,by Barron's
2021-08-04 06:17:00,Alibaba's stock rallies toward biggest gain in nearly 4 years as antitrust fine removes overhang,by Barron's
2021-08-03 16:52:00,Alibaba Was Fined $2.8 Billion by China. Why Its Stock Is Gaining.,by Barron's
2021-08-03 08:59:00,"Nuance Communications Soars on Microsoft Buyout, Alibaba Gains, and the Stock Market Is Ticking Lower",by Tomi Kilgore
2021-08-03 07:32:00,Ant Group to fall under Chinese government oversight as Alibaba’s Jack Ma yields to regulators,by Tomi Kilgore
2021-08-03 07:00:00,Alibaba shares jump after record antitrust fine by China,by Barron's
2021-08-03 06:59:00,Charlie Munger Prefers Alibaba Stock to Treasury Bills. Here’s Why.,by Emily Bary
2021-08-03 06:57:00,Alibaba hit with record $2.8 billion antitrust fine in China,by Tomi Kilgore
2021-08-03 06:56:00,The ESG fund that is attracting the most investor cash right now is hiding in plain sight,by Barron's
2021-08-03 06:56:00,How investors can tap into ‘industrial revolutions’ in countries including China and India,by Barron's
2021-08-02 14:46:00,China’s Healthcare Companies Are the Next Big Thing. Where Investors Should Look.,by Howard Gold
2021-08-02 12:13:00,Bilibili eyes $2.8 billion Hong Kong share sale,by Barron's
2021-08-02 09:09:00,Pinduoduo founder Colin Huang steps down from company,by Barron's
2021-07-31 12:28:00,Pinduoduo tops Alibaba as China's ecommerce leader,by Barron's
2021-07-31 06:00:00,"Yes, You Can Get a 5% Yield on Your Money. It’s Just Not Going to be Risk-Free.",by Tomi Kilgore
2021-07-30 20:34:00,The Covid-19 Pandemic: One Year Later,by Barron's
2021-07-29 07:51:00,The Rig Count Is Up 80% From Its 2020 Low. What That Means for the Oil Market,by Barron's
2021-07-28 15:24:00,"Coupang Is the Amazon.com of South Korea, but Maybe Even Better. And Now You Can Buy the Stock.",by Barron's
2021-07-27 20:05:00,China’s Regulators Punished Tech Giants and Rattled Investors. What Could Come Next.,by Tomi Kilgore
2021-07-27 10:33:00,Ant Group CEO Simon Hu Resigns,by Barron's
2021-07-27 03:43:00,"China denies mulling record Alibaba fine but hits Tencent, Baidu and 10 others in antitrust crackdown",by Barron's
2021-07-26 12:15:00,"China’s Antitrust Regulators Fine Tencent, Baidu and 10 Others as Big Tech Crackdown Intensifies",by Tomi Kilgore
